{
  "id": "kiki-kaikai",
  "platform": "pce",
  "category": "main_game",
  "titles": [
    {
      "text": "奇々怪界",
      "lang": "ja",
      "script": "Jpan",
      "region": "jp",
      "form": "official",
      "source": "wikidata",
      "verified": false
    },
    {
      "text": "Kiki Kaikai",
      "lang": "en",
      "script": "Latn",
      "region": "us",
      "form": "official",
      "source": "wikidata",
      "verified": false
    }
  ],
  "first_release_date": "1986-09-18",
  "external_ids": {
    "wikidata": "Q1984732",
    "mobygames": 19639
  }
}
