{
  "id": "world-advance-soccer-shouri-e-no-michi",
  "platform": "gba",
  "category": "main_game",
  "titles": [
    {
      "text": "ワールドアドバンスサッカー 勝利への道",
      "lang": "ja",
      "script": "Jpan",
      "region": "jp",
      "form": "official",
      "source": "wikidata",
      "verified": false
    },
    {
      "text": "World Advance Soccer : Shouri e no Michi",
      "lang": "en",
      "script": "Latn",
      "region": "us",
      "form": "official",
      "source": "wikidata",
      "verified": false
    }
  ],
  "first_release_date": "2001-12-07",
  "external_ids": {
    "wikidata": "Q116205183"
  }
}
