{
  "id": "animetic-story-game-1-cardcaptor-sakura",
  "platform": "ps1",
  "category": "main_game",
  "titles": [
    {
      "text": "Animetic Story Game 1: Cardcaptor Sakura",
      "lang": "en",
      "script": "Latn",
      "region": "us",
      "form": "official",
      "source": "igdb",
      "verified": false
    },
    {
      "text": "アニメチックストーリーゲーム 1 カードキャプターさくら",
      "lang": "ja",
      "script": "Jpan",
      "region": "jp",
      "form": "official",
      "source": "igdb",
      "verified": false
    }
  ],
  "external_ids": {
    "igdb": 132867
  },
  "first_release_date": "1999-08-05"
}
