{
  "id": "street-fighter-ii-turbo-q196255",
  "platform": "sfc",
  "category": "main_game",
  "titles": [
    {
      "text": "ストリートファイターII' TURBO",
      "lang": "ja",
      "script": "Kana",
      "region": "jp",
      "form": "official",
      "source": "wikidata",
      "verified": false
    },
    {
      "text": "Street Fighter II Turbo",
      "lang": "en",
      "script": "Latn",
      "region": "us",
      "form": "official",
      "source": "wikidata",
      "verified": false
    }
  ],
  "first_release_date": "1992-12-01",
  "external_ids": {
    "wikidata": "Q196255",
    "mobygames": 23379
  }
}
