{
  "id": "mick-and-mack-as-the-global-gladiators",
  "platform": "fc",
  "category": "main_game",
  "titles": [
    {
      "text": "Mick & Mack as the Global Gladiators",
      "lang": "en",
      "script": "Latn",
      "form": "official",
      "source": "no_intro",
      "verified": false,
      "region": "us"
    }
  ],
  "roms": [
    {
      "name": "Mick & Mack as the Global Gladiators (USA) (Proto 5)",
      "source": "no_intro",
      "region": "us",
      "size": 262160,
      "crc32": "1ad8ca82",
      "md5": "e2bf6fc2c804adfd1f66b062f90de29d",
      "sha1": "2a6bdc89a70a7a570ad4ffaa38ccb7eaf1497bcb",
      "sha256": "a9160ea9ca92ad428ec3692df66f0932d96bd5d10cfda10caf5e013209f11aa6"
    },
    {
      "name": "Mick & Mack as the Global Gladiators (USA) (Proto 4)",
      "source": "no_intro",
      "region": "us",
      "size": 262160,
      "crc32": "826ea662",
      "md5": "a15961de257fac912ac8bb9cf8f2b4a2",
      "sha1": "ed50dc93746b2e93668381da83cfb2106a9a3400",
      "sha256": "44a75f9c41e5ecbb1e892ed2974274a087c16cffbe2a6ae27b85d00bc2f03281"
    },
    {
      "name": "Mick & Mack as the Global Gladiators (USA) (Proto 3)",
      "source": "no_intro",
      "region": "us",
      "size": 229392,
      "crc32": "c2fd4e17",
      "md5": "9c2c93a98fd0c86118e49883eb5c231a",
      "sha1": "9dcec89ae4b39dcc6c11f0318e0dd2720c97c645",
      "sha256": "d06a57b031b318700293939f42adb137c1763053dd98f9f09b7b9dc9a9406781"
    },
    {
      "name": "Mick & Mack as the Global Gladiators (USA) (Proto 1)",
      "source": "no_intro",
      "region": "us",
      "size": 221200,
      "crc32": "5008001d",
      "md5": "9376fc8e205a2d9c7e3cdcde0f8dfa59",
      "sha1": "d01d71352f381bdc0ce84689ae95c2447d99fabd",
      "sha256": "c947f825b0c2255950079c5983ec9970324aeed6fc43be494be3064ba88d3ac3"
    },
    {
      "name": "Mick & Mack as the Global Gladiators (USA) (Proto 2)",
      "source": "no_intro",
      "region": "us",
      "size": 221200,
      "crc32": "5530c02b",
      "md5": "d2397aabcf2f0bb9fcd0247e2c9d05d6",
      "sha1": "6c5f4197366cbefe31305e68bf760c54132e4509",
      "sha256": "fe65374e54c691744156c1c29a5b11ec10a5ad8ff0c82805b53da7a6d3e91f6b"
    }
  ]
}
