{
  "id": "dushlan",
  "platform": "fc",
  "category": "main_game",
  "titles": [
    {
      "text": "Dúshlán",
      "lang": "en",
      "script": "Latn",
      "region": "us",
      "form": "official",
      "source": "igdb",
      "verified": false
    }
  ],
  "external_ids": {
    "igdb": 141077
  },
  "first_release_date": "2016-09-01"
}
