{
  "id": "super-chinese-land-3",
  "platform": "gb",
  "category": "main_game",
  "titles": [
    {
      "text": "スーパーチャイニーズランド3",
      "lang": "ja",
      "script": "Kana",
      "region": "jp",
      "form": "official",
      "source": "wikidata",
      "verified": false
    },
    {
      "text": "Super Chinese Land 3",
      "lang": "en",
      "script": "Latn",
      "region": "us",
      "form": "official",
      "source": "wikidata",
      "verified": false
    },
    {
      "text": "Super Chinese Land 3",
      "lang": "fr",
      "script": "Latn",
      "region": "fr",
      "form": "official",
      "source": "wikidata",
      "verified": false
    }
  ],
  "first_release_date": "1995-01-13",
  "external_ids": {
    "wikidata": "Q7642256",
    "igdb": 63978
  }
}
