{
  "id": "donkey-kong-plus",
  "platform": "gba",
  "category": "main_game",
  "titles": [
    {
      "text": "Donkey Kong Plus",
      "lang": "en",
      "script": "Latn",
      "region": "us",
      "form": "official",
      "source": "igdb",
      "verified": false
    }
  ],
  "external_ids": {
    "igdb": 185889
  }
}
