{
  "id": "ooze",
  "platform": "fc",
  "category": "main_game",
  "titles": [
    {
      "text": "Ooze",
      "lang": "en",
      "script": "Latn",
      "region": "us",
      "form": "official",
      "source": "igdb",
      "verified": false
    }
  ],
  "external_ids": {
    "igdb": 245062
  },
  "first_release_date": "1991-09-01"
}
