{
  "id": "lightening-force-quest-for-the-darkstar",
  "platform": "md",
  "category": "main_game",
  "titles": [
    {
      "text": "Lightening Force - Quest for the Darkstar",
      "lang": "en",
      "script": "Latn",
      "form": "official",
      "source": "no_intro",
      "verified": false,
      "region": "us"
    }
  ],
  "roms": [
    {
      "name": "Lightening Force - Quest for the Darkstar (USA)",
      "source": "no_intro",
      "region": "us",
      "serial": "MK-1143",
      "size": 1048576,
      "crc32": "c8f8c0e0",
      "md5": "bb6b10927e6238206e9a7ba8c7d91a14",
      "sha1": "ab5bd9ddbfc07d860f44b9c72d098aef2581d1d8",
      "sha256": "238ce3580bea34ede9ae5fb59263d822ed9400baaee6b402ed3370bebd1203c1"
    },
    {
      "name": "Lightening Force - Quest for the Darkstar (USA) (Sega Ages)",
      "source": "no_intro",
      "region": "us",
      "serial": "T-18063-00",
      "size": 1572864,
      "crc32": "ca90ff51",
      "md5": "177c25937f32342a5e071e500c48c484",
      "sha1": "9a2dbae344a9f0cf161c211fa1edc52abc5e5915",
      "sha256": "e80eb3233df8322af0dd7e64c0cc2e9c11536fe77d616551fefc5ba41cadb178"
    }
  ],
  "external_ids": {
    "igdb": 46273
  },
  "media": [
    {
      "kind": "boxart",
      "url": "https://raw.githubusercontent.com/libretro-thumbnails/Sega_-_Mega_Drive_-_Genesis/master/Named_Boxarts/Lightening%20Force%20-%20Quest%20for%20the%20Darkstar%20%28USA%29.png",
      "source": "libretro_thumbnails",
      "region": "us"
    },
    {
      "kind": "titlescreen",
      "url": "https://raw.githubusercontent.com/libretro-thumbnails/Sega_-_Mega_Drive_-_Genesis/master/Named_Titles/Lightening%20Force%20-%20Quest%20for%20the%20Darkstar%20%28USA%29.png",
      "source": "libretro_thumbnails",
      "region": "us"
    },
    {
      "kind": "screenshot",
      "url": "https://raw.githubusercontent.com/libretro-thumbnails/Sega_-_Mega_Drive_-_Genesis/master/Named_Snaps/Lightening%20Force%20-%20Quest%20for%20the%20Darkstar%20%28USA%29.png",
      "source": "libretro_thumbnails",
      "region": "us"
    },
    {
      "kind": "boxart",
      "url": "https://raw.githubusercontent.com/libretro-thumbnails/Sega_-_Mega_Drive_-_Genesis/master/Named_Boxarts/Lightening%20Force%20-%20Quest%20for%20the%20Darkstar%20%28USA%29%20%28Sega%20Ages%29.png",
      "source": "libretro_thumbnails",
      "region": "us"
    },
    {
      "kind": "titlescreen",
      "url": "https://raw.githubusercontent.com/libretro-thumbnails/Sega_-_Mega_Drive_-_Genesis/master/Named_Titles/Lightening%20Force%20-%20Quest%20for%20the%20Darkstar%20%28USA%29%20%28Sega%20Ages%29.png",
      "source": "libretro_thumbnails",
      "region": "us"
    },
    {
      "kind": "screenshot",
      "url": "https://raw.githubusercontent.com/libretro-thumbnails/Sega_-_Mega_Drive_-_Genesis/master/Named_Snaps/Lightening%20Force%20-%20Quest%20for%20the%20Darkstar%20%28USA%29%20%28Sega%20Ages%29.png",
      "source": "libretro_thumbnails",
      "region": "us"
    }
  ]
}
