{
  "id": "shichidasik-unoedallyeon-super-brain",
  "platform": "nds",
  "category": "main_game",
  "titles": [
    {
      "text": "Shichidasik Unoedallyeon - Super Brain",
      "lang": "en",
      "script": "Latn",
      "form": "official",
      "source": "no_intro",
      "verified": false
    }
  ],
  "roms": [
    {
      "name": "Shichidasik Unoedallyeon - Super Brain (Korea)",
      "source": "no_intro",
      "region": "kr",
      "serial": "AUXK",
      "size": 16777216,
      "crc32": "631d4dcc",
      "md5": "becd39160b513253df4610f16837a189",
      "sha1": "29b91e107484b10c2f6e21986bf989938dfaa386"
    }
  ],
  "media": [
    {
      "kind": "boxart",
      "url": "https://raw.githubusercontent.com/libretro-thumbnails/Nintendo_-_Nintendo_DS/master/Named_Boxarts/Shichidasik%20Unoedallyeon%20-%20Super%20Brain%20%28Korea%29.png",
      "source": "libretro_thumbnails",
      "region": "kr"
    },
    {
      "kind": "titlescreen",
      "url": "https://raw.githubusercontent.com/libretro-thumbnails/Nintendo_-_Nintendo_DS/master/Named_Titles/Shichidasik%20Unoedallyeon%20-%20Super%20Brain%20%28Korea%29.png",
      "source": "libretro_thumbnails",
      "region": "kr"
    },
    {
      "kind": "screenshot",
      "url": "https://raw.githubusercontent.com/libretro-thumbnails/Nintendo_-_Nintendo_DS/master/Named_Snaps/Shichidasik%20Unoedallyeon%20-%20Super%20Brain%20%28Korea%29.png",
      "source": "libretro_thumbnails",
      "region": "kr"
    }
  ]
}
