{
  "id": "tennis-no-ouji-sama-2004-glorious-gold",
  "platform": "gba",
  "category": "main_game",
  "titles": [
    {
      "text": "Tennis no Ouji-sama 2004 - Glorious Gold",
      "lang": "en",
      "script": "Latn",
      "form": "official",
      "source": "no_intro",
      "verified": false,
      "region": "jp"
    }
  ],
  "roms": [
    {
      "name": "Tennis no Ouji-sama 2004 - Glorious Gold (Japan)",
      "source": "no_intro",
      "region": "jp",
      "serial": "B4GJ",
      "size": 33554432,
      "crc32": "26a4ee5c",
      "md5": "6a9f7047118ac9b10de1b570a9b8ea77",
      "sha1": "8da569c0e410e81ec16134d472faad6397c97b0f"
    }
  ],
  "external_ids": {
    "igdb": 49847
  },
  "media": [
    {
      "kind": "boxart",
      "url": "https://raw.githubusercontent.com/libretro-thumbnails/Nintendo_-_Game_Boy_Advance/master/Named_Boxarts/Tennis%20no%20Ouji-sama%202004%20-%20Glorious%20Gold%20%28Japan%29.png",
      "source": "libretro_thumbnails",
      "region": "jp"
    },
    {
      "kind": "titlescreen",
      "url": "https://raw.githubusercontent.com/libretro-thumbnails/Nintendo_-_Game_Boy_Advance/master/Named_Titles/Tennis%20no%20Ouji-sama%202004%20-%20Glorious%20Gold%20%28Japan%29.png",
      "source": "libretro_thumbnails",
      "region": "jp"
    },
    {
      "kind": "screenshot",
      "url": "https://raw.githubusercontent.com/libretro-thumbnails/Nintendo_-_Game_Boy_Advance/master/Named_Snaps/Tennis%20no%20Ouji-sama%202004%20-%20Glorious%20Gold%20%28Japan%29.png",
      "source": "libretro_thumbnails",
      "region": "jp"
    }
  ]
}
