{
  "id": "team-buddies",
  "platform": "ps1",
  "category": "main_game",
  "titles": [
    {
      "text": "Team Buddies",
      "lang": "en",
      "script": "Latn",
      "region": "us",
      "form": "official",
      "source": "wikidata",
      "verified": false
    },
    {
      "text": "Team Buddies",
      "lang": "es",
      "script": "Latn",
      "region": "es",
      "form": "official",
      "source": "wikidata",
      "verified": false
    },
    {
      "text": "Team Buddies",
      "lang": "fr",
      "script": "Latn",
      "region": "fr",
      "form": "official",
      "source": "wikidata",
      "verified": false
    },
    {
      "text": "Team Buddies",
      "lang": "it",
      "script": "Latn",
      "region": "it",
      "form": "official",
      "source": "wikidata",
      "verified": false
    }
  ],
  "first_release_date": "2000-09-15",
  "external_ids": {
    "wikidata": "Q960854",
    "mobygames": 10984,
    "igdb": 45024
  },
  "media": [
    {
      "kind": "boxart",
      "url": "https://raw.githubusercontent.com/libretro-thumbnails/Sony_-_PlayStation/master/Named_Boxarts/Team%20Buddies%20%28USA%29.png",
      "source": "libretro_thumbnails"
    },
    {
      "kind": "titlescreen",
      "url": "https://raw.githubusercontent.com/libretro-thumbnails/Sony_-_PlayStation/master/Named_Titles/Team%20Buddies%20%28USA%29.png",
      "source": "libretro_thumbnails"
    },
    {
      "kind": "screenshot",
      "url": "https://raw.githubusercontent.com/libretro-thumbnails/Sony_-_PlayStation/master/Named_Snaps/Team%20Buddies%20%28USA%29.png",
      "source": "libretro_thumbnails"
    }
  ]
}
