{
  "id": "double-dragon-advance",
  "platform": "gba",
  "category": "main_game",
  "titles": [
    {
      "text": "ダブルドラゴン アドバンス",
      "lang": "ja",
      "script": "Kana",
      "region": "jp",
      "form": "official",
      "source": "wikidata",
      "verified": false
    },
    {
      "text": "Double Dragon Advance",
      "lang": "en",
      "script": "Latn",
      "region": "us",
      "form": "official",
      "source": "wikidata",
      "verified": false
    },
    {
      "text": "Double Dragon Advance",
      "lang": "fr",
      "script": "Latn",
      "region": "fr",
      "form": "official",
      "source": "wikidata",
      "verified": false
    },
    {
      "text": "Double Dragon Advance",
      "lang": "it",
      "script": "Latn",
      "region": "it",
      "form": "official",
      "source": "wikidata",
      "verified": false
    },
    {
      "text": "ダブルドラゴンアドバンス",
      "lang": "ja",
      "script": "Kana",
      "region": "jp",
      "form": "official",
      "source": "igdb",
      "verified": true
    },
    {
      "text": "더블 드래곤 어드밴스",
      "lang": "ko",
      "script": "Hang",
      "region": "kr",
      "form": "official",
      "source": "igdb",
      "verified": true
    }
  ],
  "first_release_date": "2003-11-13",
  "external_ids": {
    "wikidata": "Q3714563",
    "mobygames": 1839,
    "igdb": 6384
  }
}
