{
  "id": "ookiku-furikabutte-honto-no-ace-ni-nareru-kamo",
  "platform": "nds",
  "category": "main_game",
  "titles": [
    {
      "text": "Ookiku Furikabutte - Honto no Ace ni Nareru kamo",
      "lang": "en",
      "script": "Latn",
      "form": "official",
      "source": "no_intro",
      "verified": false,
      "region": "jp"
    }
  ],
  "roms": [
    {
      "name": "Ookiku Furikabutte - Honto no Ace ni Nareru kamo (Japan)",
      "source": "no_intro",
      "region": "jp",
      "serial": "YOFJ",
      "size": 33554432,
      "crc32": "bc661348",
      "md5": "2ade7be7a5205127c338b26fd2b8ab40",
      "sha1": "9c315041874a7efd234f87a60239877c02e78552",
      "sha256": "c07f7c5d74bfbad9281b3cc8bfb558b3d9aff9df23a0dd1f1981c3f5eb18e164"
    }
  ],
  "media": [
    {
      "kind": "boxart",
      "url": "https://raw.githubusercontent.com/libretro-thumbnails/Nintendo_-_Nintendo_DS/master/Named_Boxarts/Ookiku%20Furikabutte%20-%20Honto%20no%20Ace%20ni%20Nareru%20kamo%20%28Japan%29.png",
      "source": "libretro_thumbnails",
      "region": "jp"
    },
    {
      "kind": "titlescreen",
      "url": "https://raw.githubusercontent.com/libretro-thumbnails/Nintendo_-_Nintendo_DS/master/Named_Titles/Ookiku%20Furikabutte%20-%20Honto%20no%20Ace%20ni%20Nareru%20kamo%20%28Japan%29.png",
      "source": "libretro_thumbnails",
      "region": "jp"
    },
    {
      "kind": "screenshot",
      "url": "https://raw.githubusercontent.com/libretro-thumbnails/Nintendo_-_Nintendo_DS/master/Named_Snaps/Ookiku%20Furikabutte%20-%20Honto%20no%20Ace%20ni%20Nareru%20kamo%20%28Japan%29.png",
      "source": "libretro_thumbnails",
      "region": "jp"
    }
  ]
}
