{
  "id": "i-spy-fun-house",
  "platform": "nds",
  "category": "main_game",
  "titles": [
    {
      "text": "I Spy - Fun House",
      "lang": "en",
      "script": "Latn",
      "form": "official",
      "source": "no_intro",
      "verified": false,
      "region": "us"
    }
  ],
  "roms": [
    {
      "name": "I Spy - Fun House (USA)",
      "source": "no_intro",
      "region": "us",
      "serial": "YP5E",
      "size": 16777216,
      "crc32": "53b5993c",
      "md5": "7df60fc35046f1391d746007c0948e84",
      "sha1": "06901d350d91e8b262e56911cce03418ad7d8b21"
    },
    {
      "name": "I Spy - Fun House (Europe)",
      "source": "no_intro",
      "region": "eu",
      "serial": "YP5P",
      "size": 16777216,
      "crc32": "87b70061",
      "md5": "e19e1433342df85d8fdea7d6dc6d2bac",
      "sha1": "0a57fde6605b56228f10489c952771229c1be357"
    },
    {
      "name": "I Spy - Fun House (Europe) (En,Fr,De,It,Nl)",
      "source": "no_intro",
      "region": "eu",
      "serial": "YP5X",
      "size": 33554432,
      "crc32": "81d00ced",
      "md5": "273d864fa11dc0e25a7f600724f7e4a2",
      "sha1": "6abff751c658c2b41e5f9aa218c219bcbb942841"
    },
    {
      "name": "I Spy - Fun House (Europe) (En,Ru) (Beta)",
      "source": "no_intro",
      "region": "eu",
      "serial": "YP5X",
      "size": 67108864,
      "crc32": "c046e007",
      "md5": "ca5f89627022055f167482efa16ac84c",
      "sha1": "72d0c12a7022fe9f036939ca5721b74ca76234b2",
      "sha256": "7a5c3c484d256f3a00f756c31077b071f5f5ef0c37074f88ff1dfbbfdd0a73b5"
    }
  ],
  "external_ids": {
    "igdb": 47784
  }
}
