{
  "id": "superman",
  "platform": "fc",
  "category": "main_game",
  "titles": [
    {
      "text": "スーパーマン",
      "lang": "ja",
      "script": "Kana",
      "region": "jp",
      "form": "official",
      "source": "wikidata",
      "verified": false
    },
    {
      "text": "Superman",
      "lang": "en",
      "script": "Latn",
      "region": "us",
      "form": "official",
      "source": "wikidata",
      "verified": false
    },
    {
      "text": "Superman",
      "lang": "es",
      "script": "Latn",
      "region": "es",
      "form": "official",
      "source": "wikidata",
      "verified": false
    },
    {
      "text": "Superman",
      "lang": "fr",
      "script": "Latn",
      "region": "fr",
      "form": "official",
      "source": "wikidata",
      "verified": false
    },
    {
      "text": "Superman",
      "lang": "de",
      "script": "Latn",
      "region": "de",
      "form": "official",
      "source": "wikidata",
      "verified": false
    },
    {
      "text": "Superman",
      "lang": "it",
      "script": "Latn",
      "region": "it",
      "form": "official",
      "source": "wikidata",
      "verified": false
    }
  ],
  "first_release_date": "1987-12-22",
  "external_ids": {
    "wikidata": "Q4353838",
    "mobygames": 18148,
    "igdb": 68440
  },
  "roms": [
    {
      "name": "Superman (Japan)",
      "source": "no_intro",
      "region": "jp",
      "size": 262160,
      "crc32": "79f7bd86",
      "md5": "f3f9963a0819dc4debf219d50f4e6ccd",
      "sha1": "27d781a35b11f60f572418a21917d501c2114d44",
      "sha256": "d99f3bf81ee8560107d3ef6707db44c446773557747b5e7e1628aaa7300a3050"
    },
    {
      "name": "Superman (USA) (Kemco)",
      "source": "no_intro",
      "region": "us",
      "size": 262160,
      "crc32": "e3310f22",
      "md5": "b8222ed94a66af91097f74ec8ea72454",
      "sha1": "5f5d76056bc45a0234d155e53a10d4ace546b35f",
      "sha256": "e3ab3a50976ca64a3fc68eb5da80b29feea4cef913ed7955cb659ed02b9f1e9b"
    },
    {
      "name": "Superman (USA) (Proto) (Sunsoft)",
      "source": "no_intro",
      "region": "us",
      "size": 262160,
      "crc32": "fc4e1a5a",
      "md5": "de0ce6434909b012615e6f7e2eb36d66",
      "sha1": "435a124841355da5092b0f160b4ce3f85ac0bdac",
      "sha256": "631c6a7fc82352c64dc36db0c8e6f6c9824d17b2989b5777ed14dfaf75bbc2df"
    },
    {
      "name": "Superman (Japan) (Beta)",
      "source": "no_intro",
      "region": "jp",
      "size": 262160,
      "crc32": "221dfecc",
      "md5": "dd6b8dd38adabcf4f6d4ae3d07cadc74",
      "sha1": "4f6ad60b363d45d566d8ed55dcb7c6f813fc2e9a",
      "sha256": "73aa30b1b5079ddb68a888ec75875df007b8da23a44765cc2a04bc0430f3d2cc"
    }
  ],
  "media": [
    {
      "kind": "boxart",
      "url": "https://raw.githubusercontent.com/libretro-thumbnails/Nintendo_-_Nintendo_Entertainment_System/master/Named_Boxarts/Superman%20%28Japan%29.png",
      "source": "libretro_thumbnails",
      "region": "jp"
    },
    {
      "kind": "titlescreen",
      "url": "https://raw.githubusercontent.com/libretro-thumbnails/Nintendo_-_Nintendo_Entertainment_System/master/Named_Titles/Superman%20%28Japan%29.png",
      "source": "libretro_thumbnails",
      "region": "jp"
    },
    {
      "kind": "screenshot",
      "url": "https://raw.githubusercontent.com/libretro-thumbnails/Nintendo_-_Nintendo_Entertainment_System/master/Named_Snaps/Superman%20%28Japan%29.png",
      "source": "libretro_thumbnails",
      "region": "jp"
    },
    {
      "kind": "boxart",
      "url": "https://raw.githubusercontent.com/libretro-thumbnails/Nintendo_-_Nintendo_Entertainment_System/master/Named_Boxarts/Superman%20%28USA%29%20%28Kemco%29.png",
      "source": "libretro_thumbnails",
      "region": "us"
    },
    {
      "kind": "titlescreen",
      "url": "https://raw.githubusercontent.com/libretro-thumbnails/Nintendo_-_Nintendo_Entertainment_System/master/Named_Titles/Superman%20%28USA%29%20%28Kemco%29.png",
      "source": "libretro_thumbnails",
      "region": "us"
    },
    {
      "kind": "screenshot",
      "url": "https://raw.githubusercontent.com/libretro-thumbnails/Nintendo_-_Nintendo_Entertainment_System/master/Named_Snaps/Superman%20%28USA%29%20%28Kemco%29.png",
      "source": "libretro_thumbnails",
      "region": "us"
    },
    {
      "kind": "boxart",
      "url": "https://raw.githubusercontent.com/libretro-thumbnails/Nintendo_-_Nintendo_Entertainment_System/master/Named_Boxarts/Superman%20%28USA%29%20%28Proto%29%20%28Sunsoft%29.png",
      "source": "libretro_thumbnails",
      "region": "us"
    },
    {
      "kind": "titlescreen",
      "url": "https://raw.githubusercontent.com/libretro-thumbnails/Nintendo_-_Nintendo_Entertainment_System/master/Named_Titles/Superman%20%28USA%29%20%28Proto%29%20%28Sunsoft%29.png",
      "source": "libretro_thumbnails",
      "region": "us"
    },
    {
      "kind": "screenshot",
      "url": "https://raw.githubusercontent.com/libretro-thumbnails/Nintendo_-_Nintendo_Entertainment_System/master/Named_Snaps/Superman%20%28USA%29%20%28Proto%29%20%28Sunsoft%29.png",
      "source": "libretro_thumbnails",
      "region": "us"
    },
    {
      "kind": "boxart",
      "url": "https://raw.githubusercontent.com/libretro-thumbnails/Nintendo_-_Nintendo_Entertainment_System/master/Named_Boxarts/Superman%20%28Japan%29%20%28Beta%29.png",
      "source": "libretro_thumbnails",
      "region": "jp"
    },
    {
      "kind": "titlescreen",
      "url": "https://raw.githubusercontent.com/libretro-thumbnails/Nintendo_-_Nintendo_Entertainment_System/master/Named_Titles/Superman%20%28Japan%29%20%28Beta%29.png",
      "source": "libretro_thumbnails",
      "region": "jp"
    },
    {
      "kind": "screenshot",
      "url": "https://raw.githubusercontent.com/libretro-thumbnails/Nintendo_-_Nintendo_Entertainment_System/master/Named_Snaps/Superman%20%28Japan%29%20%28Beta%29.png",
      "source": "libretro_thumbnails",
      "region": "jp"
    },
    {
      "kind": "titlescreen",
      "url": "https://raw.githubusercontent.com/libretro-thumbnails/Nintendo_-_Nintendo_Entertainment_System/master/Named_Titles/Superman%20%28USA%29.png",
      "source": "libretro_thumbnails"
    },
    {
      "kind": "screenshot",
      "url": "https://raw.githubusercontent.com/libretro-thumbnails/Nintendo_-_Nintendo_Entertainment_System/master/Named_Snaps/Superman%20%28USA%29.png",
      "source": "libretro_thumbnails"
    }
  ]
}
