{
  "id": "apocalypse-ii",
  "platform": "sfc",
  "category": "main_game",
  "titles": [
    {
      "text": "Apocalypse II",
      "lang": "en",
      "script": "Latn",
      "form": "official",
      "source": "no_intro",
      "verified": false,
      "region": "eu"
    }
  ],
  "roms": [
    {
      "name": "Apocalypse II (Europe) (Proto 1)",
      "source": "no_intro",
      "region": "eu",
      "size": 1048576,
      "crc32": "6a53c658",
      "md5": "d6338907994390837d6dbb8d3b99563f",
      "sha1": "95640a8ecff7a5380c71fd2a4915f22341870769",
      "sha256": "b4267c180cf69b884a020621588437aa8aa7f4aea76a5e3486aaec0c7c8e9f17"
    },
    {
      "name": "Apocalypse II (Europe) (Proto 2) (1997-10-28)",
      "source": "no_intro",
      "region": "eu",
      "size": 1048576,
      "crc32": "93557c67",
      "md5": "2f640607c1f49f5cfe6118df59de1eda",
      "sha1": "2d7d6c5a5dd6eb9e165ef8b27b9dd23626f0fbda",
      "sha256": "228e142b71f88b5bd36a51afc5d4a37d4f687b37f6e2b36bdac79f8cefe72043"
    }
  ],
  "external_ids": {
    "igdb": 42434
  }
}
