{
  "id": "the-adventures-of-tintin-prisoners-of-the-sun",
  "platform": "gbc",
  "category": "main_game",
  "titles": [
    {
      "text": "The Adventures of Tintin: Prisoners of the Sun",
      "lang": "en",
      "script": "Latn",
      "region": "us",
      "form": "official",
      "source": "igdb",
      "verified": false
    }
  ],
  "external_ids": {
    "igdb": 50042
  },
  "first_release_date": "1997-12-31"
}
