{
  "id": "nicola-kanshuu-model-oshare-audition",
  "platform": "nds",
  "category": "main_game",
  "titles": [
    {
      "text": "Nicola Kanshuu - Model Oshare Audition",
      "lang": "en",
      "script": "Latn",
      "form": "official",
      "source": "no_intro",
      "verified": false,
      "region": "jp"
    }
  ],
  "roms": [
    {
      "name": "Nicola Kanshuu - Model Oshare Audition (Japan)",
      "source": "no_intro",
      "region": "jp",
      "serial": "B2OJ",
      "size": 33554432,
      "crc32": "2baaf018",
      "md5": "5a91a994d65e259701c2e869f8d43e13",
      "sha1": "cf47de47ab899115fb0ea8335aa0650abd3bfee8"
    }
  ],
  "media": [
    {
      "kind": "boxart",
      "url": "https://raw.githubusercontent.com/libretro-thumbnails/Nintendo_-_Nintendo_DS/master/Named_Boxarts/Nicola%20Kanshuu%20-%20Model%20Oshare%20Audition%20%28Japan%29.png",
      "source": "libretro_thumbnails",
      "region": "jp"
    },
    {
      "kind": "screenshot",
      "url": "https://raw.githubusercontent.com/libretro-thumbnails/Nintendo_-_Nintendo_DS/master/Named_Snaps/Nicola%20Kanshuu%20-%20Model%20Oshare%20Audition%20%28Japan%29.png",
      "source": "libretro_thumbnails",
      "region": "jp"
    }
  ]
}
