{
  "id": "1st-video-game",
  "platform": "md",
  "category": "main_game",
  "titles": [
    {
      "text": "1st Video Game",
      "lang": "en",
      "script": "Latn",
      "region": "us",
      "form": "official",
      "source": "igdb",
      "verified": false
    }
  ],
  "external_ids": {
    "igdb": 245162
  },
  "first_release_date": "1993-05-28"
}
