{
  "id": "snowcross",
  "platform": "gbc",
  "category": "main_game",
  "titles": [
    {
      "text": "SnowCross",
      "lang": "en",
      "script": "Latn",
      "form": "official",
      "source": "no_intro",
      "verified": false,
      "region": "eu"
    }
  ],
  "roms": [
    {
      "name": "SnowCross (Europe) (En,Fr,De,Es,It,Pt)",
      "source": "no_intro",
      "region": "eu",
      "size": 1048576,
      "crc32": "4ba47dbc",
      "md5": "523fac00115280ede5ac1647552b2024",
      "sha1": "436bed2117772f4632a37d54a83e2310dddf1121"
    }
  ],
  "external_ids": {
    "igdb": 50067
  },
  "media": [
    {
      "kind": "boxart",
      "url": "https://raw.githubusercontent.com/libretro-thumbnails/Nintendo_-_Game_Boy_Color/master/Named_Boxarts/SnowCross%20%28Europe%29%20%28En%2CFr%2CDe%2CEs%2CIt%2CPt%29.png",
      "source": "libretro_thumbnails",
      "region": "eu"
    },
    {
      "kind": "titlescreen",
      "url": "https://raw.githubusercontent.com/libretro-thumbnails/Nintendo_-_Game_Boy_Color/master/Named_Titles/SnowCross%20%28Europe%29%20%28En%2CFr%2CDe%2CEs%2CIt%2CPt%29.png",
      "source": "libretro_thumbnails",
      "region": "eu"
    },
    {
      "kind": "screenshot",
      "url": "https://raw.githubusercontent.com/libretro-thumbnails/Nintendo_-_Game_Boy_Color/master/Named_Snaps/SnowCross%20%28Europe%29%20%28En%2CFr%2CDe%2CEs%2CIt%2CPt%29.png",
      "source": "libretro_thumbnails",
      "region": "eu"
    }
  ]
}
