{
  "id": "trackmania-ds",
  "platform": "nds",
  "category": "main_game",
  "titles": [
    {
      "text": "TrackMania DS",
      "lang": "en",
      "script": "Latn",
      "form": "official",
      "source": "no_intro",
      "verified": false,
      "region": "us"
    }
  ],
  "roms": [
    {
      "name": "TrackMania DS (Europe) (En,Fr,De,Es,It)",
      "source": "no_intro",
      "region": "eu",
      "serial": "CTRP",
      "size": 33554432,
      "crc32": "55c54655",
      "md5": "4b6a75c45b787e4bb8e80ede4e9d01e4",
      "sha1": "20b54097617f3fdead1d13b2d71e5d698564b78f",
      "sha256": "1e0be1a42143861bc9ca4790b11bd270822c677d5ec548bed3c6be8f91f45be3"
    },
    {
      "name": "TrackMania DS (USA) (En,Fr,Es)",
      "source": "no_intro",
      "region": "us",
      "serial": "CTRE",
      "size": 33554432,
      "crc32": "953784ee",
      "md5": "07a8f63285741f3a461f9991b56c01c6",
      "sha1": "cb3d7bc711edd63b3a079375bbab719d8f6f1ade"
    }
  ],
  "external_ids": {
    "igdb": 21304
  },
  "media": [
    {
      "kind": "boxart",
      "url": "https://raw.githubusercontent.com/libretro-thumbnails/Nintendo_-_Nintendo_DS/master/Named_Boxarts/TrackMania%20DS%20%28Europe%29%20%28En%2CFr%2CDe%2CEs%2CIt%29.png",
      "source": "libretro_thumbnails",
      "region": "eu"
    },
    {
      "kind": "screenshot",
      "url": "https://raw.githubusercontent.com/libretro-thumbnails/Nintendo_-_Nintendo_DS/master/Named_Snaps/TrackMania%20DS%20%28Europe%29%20%28En%2CFr%2CDe%2CEs%2CIt%29.png",
      "source": "libretro_thumbnails",
      "region": "eu"
    },
    {
      "kind": "boxart",
      "url": "https://raw.githubusercontent.com/libretro-thumbnails/Nintendo_-_Nintendo_DS/master/Named_Boxarts/TrackMania%20DS%20%28USA%29%20%28En%2CFr%2CEs%29.png",
      "source": "libretro_thumbnails",
      "region": "us"
    },
    {
      "kind": "screenshot",
      "url": "https://raw.githubusercontent.com/libretro-thumbnails/Nintendo_-_Nintendo_DS/master/Named_Snaps/TrackMania%20DS%20%28USA%29%20%28En%2CFr%2CEs%29.png",
      "source": "libretro_thumbnails",
      "region": "us"
    }
  ]
}
