{
  "id": "deez-shells",
  "platform": "sfc",
  "category": "main_game",
  "titles": [
    {
      "text": "Deez Shells",
      "lang": "en",
      "script": "Latn",
      "region": "us",
      "form": "official",
      "source": "igdb",
      "verified": false
    }
  ],
  "external_ids": {
    "igdb": 328067
  },
  "first_release_date": "2023-05-30"
}
